{
  "version": "rava-verification-receipt-v0",
  "id": "ver_58a487292b5b06f031bf40d41a2f2148",
  "nonce": "44444444-4444-4444-8444-444444444444",
  "verifier": "rava:service:ca93ac1705187071d67b83c7ff0efe81",
  "action_id": "act_4895d1ad8dd04025cb89a68c3f530621",
  "actor": "rava:agent:ed4928c628d1c2c6eae9033890599561",
  "capability_id": "cap_faff91b4425d487f1f25c1599cea0be9",
  "capability_chain_hash": "sha256:ffffffffffffffffffffffffffffffffffffffffffffffffffffffffffffffff",
  "context_hash": "sha256:2222222222222222222222222222222222222222222222222222222222222222",
  "decision": "accepted",
  "reason": null,
  "verified_at": [
    2022,
    105,
    5,
    20,
    0,
    0,
    0,
    0,
    0
  ],
  "proof": {
    "signature_hex": "eabaa90940ef25f2b55aae0ecfd5739d016dad60a26daa94acf8f9d4f39215052d6c667eaa7066351cda7f30d677928b4adc243e8db4785a0c4eff3c51a2f902"
  }
}